[
  {
    "articleNumber": 111117994.0,
    "branchNumber": 3,
    "articleSizeNumber": 7613306336525.0,
    "customerNumber": 199,
    "currencyNumber": "",
    "countryNumber": "",
    "staffNumber": 185,
    "receiptNumber": 16935215,
    "date": "2015-11-13T00:00:00",
    "purchasePrice": 12.43,
    "id": "67a6e804-9eff-4aa3-bb98-2138c360b14d",
    "cashierNumber": 997,
    "discount": 5.99,
    "cashRegisterNumber": 16,
    "deduction": 0.0,
    "zipCode": "",
    "staffDiscount": 0.0,
    "receiptPosition": 1,
    "priceChangeReasonNumber": 0,
    "returnReasonNumber": 0,
    "quantity": 1.0,
    "salePrice": 23.96,
    "labelPrice": 0.0,
    "paymentOptionNumber": 0,
    "time": 42360,
    "type": 2,
    "alternativeReceiptNumber": "",
    "lastChange": "2019-10-22T18:13:29.927294",
    "isDeleted": false
  },
  {
    "articleNumber": 111117990.0,
    "branchNumber": 3,
    "articleSizeNumber": 7613306336440.0,
    "customerNumber": 199,
    "currencyNumber": "",
    "countryNumber": "",
    "staffNumber": 185,
    "receiptNumber": 16935215,
    "date": "2015-11-13T00:00:00",
    "purchasePrice": 10.35,
    "id": "2d4d932b-c308-4337-adc7-88d0c65dc9d4",
    "cashierNumber": 997,
    "discount": 4.99,
    "cashRegisterNumber": 16,
    "deduction": 0.0,
    "zipCode": "",
    "staffDiscount": 0.0,
    "receiptPosition": 2,
    "priceChangeReasonNumber": 0,
    "returnReasonNumber": 0,
    "quantity": 1.0,
    "salePrice": 19.96,
    "labelPrice": 0.0,
    "paymentOptionNumber": 0,
    "time": 42360,
    "type": 2,
    "alternativeReceiptNumber": "",
    "lastChange": "2019-10-22T18:13:29.927294",
    "isDeleted": false
  },
  {
    "articleNumber": 110744210.0,
    "branchNumber": 3,
    "articleSizeNumber": 7610441130698.0,
    "customerNumber": 199,
    "currencyNumber": "",
    "countryNumber": "",
    "staffNumber": 185,
    "receiptNumber": 16935215,
    "date": "2015-11-13T00:00:00",
    "purchasePrice": 20.73,
    "id": "bc5d754f-b16a-4620-b12e-df16a191fff5",
    "cashierNumber": 997,
    "discount": 29.97,
    "cashRegisterNumber": 16,
    "deduction": 0.0,
    "zipCode": "",
    "staffDiscount": 0.0,
    "receiptPosition": 3,
    "priceChangeReasonNumber": 0,
    "returnReasonNumber": 0,
    "quantity": 1.0,
    "salePrice": 19.98,
    "labelPrice": 0.0,
    "paymentOptionNumber": 0,
    "time": 42360,
    "type": 2,
    "alternativeReceiptNumber": "",
    "lastChange": "2019-10-22T18:13:29.927294",
    "isDeleted": false
  },
  {
    "articleNumber": 111117994.0,
    "branchNumber": 3,
    "articleSizeNumber": 7613306336525.0,
    "customerNumber": 199,
    "currencyNumber": "",
    "countryNumber": "",
    "staffNumber": 185,
    "receiptNumber": 16935215,
    "date": "2015-11-13T00:00:00",
    "purchasePrice": -12.43,
    "id": "8db36d60-bfa4-4b7b-a854-713d4adc7fad",
    "cashierNumber": 997,
    "discount": -5.99,
    "cashRegisterNumber": 16,
    "deduction": 0.0,
    "zipCode": "",
    "staffDiscount": 0.0,
    "receiptPosition": 500001,
    "priceChangeReasonNumber": 0,
    "returnReasonNumber": 0,
    "quantity": -1.0,
    "salePrice": -23.96,
    "labelPrice": 0.0,
    "paymentOptionNumber": 0,
    "time": 42360,
    "type": 2,
    "alternativeReceiptNumber": "",
    "lastChange": "2019-10-22T18:13:29.927294",
    "isDeleted": false
  },
  {
    "articleNumber": 111117990.0,
    "branchNumber": 3,
    "articleSizeNumber": 7613306336440.0,
    "customerNumber": 199,
    "currencyNumber": "",
    "countryNumber": "",
    "staffNumber": 185,
    "receiptNumber": 16935215,
    "date": "2015-11-13T00:00:00",
    "purchasePrice": -10.35,
    "id": "d6cdcbf1-de65-4290-8117-f35eaeaba0b8",
    "cashierNumber": 997,
    "discount": -4.99,
    "cashRegisterNumber": 16,
    "deduction": 0.0,
    "zipCode": "",
    "staffDiscount": 0.0,
    "receiptPosition": 500002,
    "priceChangeReasonNumber": 0,
    "returnReasonNumber": 0,
    "quantity": -1.0,
    "salePrice": -19.96,
    "labelPrice": 0.0,
    "paymentOptionNumber": 0,
    "time": 42360,
    "type": 2,
    "alternativeReceiptNumber": "",
    "lastChange": "2019-10-22T18:13:29.927294",
    "isDeleted": false
  },
  {
    "articleNumber": 110744210.0,
    "branchNumber": 3,
    "articleSizeNumber": 7610441130698.0,
    "customerNumber": 199,
    "currencyNumber": "",
    "countryNumber": "",
    "staffNumber": 185,
    "receiptNumber": 16935215,
    "date": "2015-11-13T00:00:00",
    "purchasePrice": -20.73,
    "id": "666c385f-2c8e-4e87-b13a-1cb0fd612b59",
    "cashierNumber": 997,
    "discount": -29.97,
    "cashRegisterNumber": 16,
    "deduction": 0.0,
    "zipCode": "",
    "staffDiscount": 0.0,
    "receiptPosition": 500003,
    "priceChangeReasonNumber": 0,
    "returnReasonNumber": 0,
    "quantity": -1.0,
    "salePrice": -19.98,
    "labelPrice": 0.0,
    "paymentOptionNumber": 0,
    "time": 42360,
    "type": 2,
    "alternativeReceiptNumber": "",
    "lastChange": "2019-10-22T18:13:29.927294",
    "isDeleted": false
  },
  {
    "articleNumber": 110601244.0,
    "branchNumber": 3,
    "articleSizeNumber": 207426359.0,
    "customerNumber": 0,
    "currencyNumber": "",
    "countryNumber": "",
    "staffNumber": 130,
    "receiptNumber": 16061488,
    "date": "2020-03-16T00:00:00",
    "purchasePrice": 50.0,
    "id": "e35b57aa-8217-3f8e-6514-dc95c4fb4a2d",
    "cashierNumber": 997,
    "discount": 0.0,
    "cashRegisterNumber": 16,
    "deduction": 0.0,
    "zipCode": "",
    "staffDiscount": 0.0,
    "receiptPosition": 1,
    "priceChangeReasonNumber": 0,
    "returnReasonNumber": 0,
    "quantity": 1.0,
    "salePrice": 50.0,
    "labelPrice": 0.0,
    "paymentOptionNumber": 1,
    "time": 64270,
    "type": 0,
    "alternativeReceiptNumber": "",
    "lastChange": "2020-03-16T18:30:36.3333826",
    "isDeleted": false
  },
  {
    "articleNumber": 110601244.0,
    "branchNumber": 3,
    "articleSizeNumber": 207426359.0,
    "customerNumber": 0,
    "currencyNumber": "",
    "countryNumber": "",
    "staffNumber": 130,
    "receiptNumber": 16061488,
    "date": "2020-03-16T00:00:00",
    "purchasePrice": 50.0,
    "id": "e35b57aa-8217-3f8e-6514-dc957831572d",
    "cashierNumber": 997,
    "discount": 0.0,
    "cashRegisterNumber": 16,
    "deduction": 0.0,
    "zipCode": "",
    "staffDiscount": 0.0,
    "receiptPosition": 2,
    "priceChangeReasonNumber": 0,
    "returnReasonNumber": 0,
    "quantity": 1.0,
    "salePrice": 50.0,
    "labelPrice": 0.0,
    "paymentOptionNumber": 1,
    "time": 64270,
    "type": 0,
    "alternativeReceiptNumber": "",
    "lastChange": "2020-03-16T18:30:36.3333826",
    "isDeleted": false
  },
  {
    "articleNumber": 110601244.0,
    "branchNumber": 3,
    "articleSizeNumber": 207426359.0,
    "customerNumber": 0,
    "currencyNumber": "",
    "countryNumber": "",
    "staffNumber": 130,
    "receiptNumber": 16061488,
    "date": "2020-03-16T00:00:00",
    "purchasePrice": 50.0,
    "id": "e35b57aa-8217-3f8e-6514-dc95f857602d",
    "cashierNumber": 997,
    "discount": 0.0,
    "cashRegisterNumber": 16,
    "deduction": 0.0,
    "zipCode": "",
    "staffDiscount": 0.0,
    "receiptPosition": 3,
    "priceChangeReasonNumber": 0,
    "returnReasonNumber": 0,
    "quantity": 1.0,
    "salePrice": 50.0,
    "labelPrice": 0.0,
    "paymentOptionNumber": 1,
    "time": 64270,
    "type": 0,
    "alternativeReceiptNumber": "",
    "lastChange": "2020-03-16T18:30:36.3333826",
    "isDeleted": false
  },
  {
    "articleNumber": 110601244.0,
    "branchNumber": 3,
    "articleSizeNumber": 207426359.0,
    "customerNumber": 0,
    "currencyNumber": "",
    "countryNumber": "",
    "staffNumber": 130,
    "receiptNumber": 16061488,
    "date": "2020-03-16T00:00:00",
    "purchasePrice": 50.0,
    "id": "e35b57aa-8217-3f8e-6514-dc95c081692d",
    "cashierNumber": 997,
    "discount": 0.0,
    "cashRegisterNumber": 16,
    "deduction": 0.0,
    "zipCode": "",
    "staffDiscount": 0.0,
    "receiptPosition": 4,
    "priceChangeReasonNumber": 0,
    "returnReasonNumber": 0,
    "quantity": 1.0,
    "salePrice": 50.0,
    "labelPrice": 0.0,
    "paymentOptionNumber": 1,
    "time": 64270,
    "type": 0,
    "alternativeReceiptNumber": "",
    "lastChange": "2020-03-16T18:30:36.3333826",
    "isDeleted": false
  },
  {
    "articleNumber": 111338987.0,
    "branchNumber": 3,
    "articleSizeNumber": 207073643.0,
    "customerNumber": 0,
    "currencyNumber": "",
    "countryNumber": "",
    "staffNumber": 84,
    "receiptNumber": 16061487,
    "date": "2020-03-16T00:00:00",
    "purchasePrice": 2.5,
    "id": "d3f444ac-4882-ffa9-6514-34955879fc8a",
    "cashierNumber": 997,
    "discount": 3.0,
    "cashRegisterNumber": 16,
    "deduction": 0.0,
    "zipCode": "",
    "staffDiscount": 0.0,
    "receiptPosition": 1,
    "priceChangeReasonNumber": 0,
    "returnReasonNumber": 0,
    "quantity": 1.0,
    "salePrice": 3.0,
    "labelPrice": 6.0,
    "paymentOptionNumber": 2,
    "time": 61913,
    "type": 0,
    "alternativeReceiptNumber": "",
    "lastChange": "2020-03-16T17:30:26.4125056",
    "isDeleted": false
  },
  {
    "articleNumber": 111448673.0,
    "branchNumber": 3,
    "articleSizeNumber": 4333853469356.0,
    "customerNumber": 0,
    "currencyNumber": "",
    "countryNumber": "",
    "staffNumber": 84,
    "receiptNumber": 16061487,
    "date": "2020-03-16T00:00:00",
    "purchasePrice": 2.1,
    "id": "d3f444ac-4882-ffa9-6514-3495aca3058b",
    "cashierNumber": 997,
    "discount": 4.5,
    "cashRegisterNumber": 16,
    "deduction": 0.0,
    "zipCode": "",
    "staffDiscount": 0.0,
    "receiptPosition": 2,
    "priceChangeReasonNumber": 0,
    "returnReasonNumber": 0,
    "quantity": 1.0,
    "salePrice": 4.49,
    "labelPrice": 8.99,
    "paymentOptionNumber": 2,
    "time": 61913,
    "type": 0,
    "alternativeReceiptNumber": "",
    "lastChange": "2020-03-16T17:30:26.4125056",
    "isDeleted": false
  },
  {
    "articleNumber": 111244547.0,
    "branchNumber": 3,